"","category","over_represented_pvalue","under_represented_pvalue","numDEInCat","numInCat","term","ontology"
"14882","GO:0070062",0.0117096250872752,0.989888156472562,503,1956,"extracellular exosome","CC"
"6964","GO:0030101",0.0117097128949217,0.993865326751621,29,84,"natural killer cell activation","BP"
"2015","GO:0004576",0.0117283550387792,0.999333462920421,4,5,"oligosaccharyl transferase activity","MF"
"2018","GO:0004579",0.0117283550387792,0.999333462920421,4,5,"dolichyl-diphosphooligosaccharide-protein glycotransferase activity","MF"
"9710","GO:0035976",0.011810391162244,0.999327276081895,4,5,"transcription factor AP-1 complex","CC"
"16514","GO:0090199",0.0118209292265747,0.995309476419687,16,40,"regulation of release of cytochrome c from mitochondria","BP"
"14381","GO:0061044",0.0118466765074947,0.999324534843091,4,5,"negative regulation of vascular wound healing","BP"
"2822","GO:0006023",0.0118826285430889,0.99398747624473,27,73,"aminoglycan biosynthetic process","BP"
"7960","GO:0032183",0.011894800939308,0.997046725150873,9,17,"SUMO binding","MF"
"4196","GO:0009101",0.0120617016343162,0.991465360329474,90,298,"glycoprotein biosynthetic process","BP"
"4457","GO:0009791",0.0121256529712376,0.993534050191396,31,85,"post-embryonic development","BP"
"17244","GO:0098758",0.0122316247331819,1,3,3,"response to interleukin-8","BP"
"17245","GO:0098759",0.0122316247331819,1,3,3,"cellular response to interleukin-8","BP"
"1576","GO:0003714",0.0122477551943612,0.991998711416598,61,193,"transcription corepressor activity","MF"
"16677","GO:0090559",0.0122662629810366,0.994028503929549,24,66,"regulation of membrane permeability","BP"
"19133","GO:1901800",0.0122762365660666,0.993001193161595,37,109,"positive regulation of proteasomal protein catabolic process","BP"
"18536","GO:0150077",0.0122800561816893,0.995509597185197,14,33,"regulation of neuroinflammatory response","BP"
"4248","GO:0009162",0.0123592641497706,0.996189238694396,11,24,"deoxyribonucleoside monophosphate metabolic process","BP"
"19607","GO:1902996",0.0123623605252423,1,3,3,"regulation of neurofibrillary tangle assembly","BP"
"2821","GO:0006022",0.0124139314272958,0.992745606665891,40,119,"aminoglycan metabolic process","BP"
"3504","GO:0007155",0.0124783636652988,0.989413243313264,389,1450,"cell adhesion","BP"
"19131","GO:1901798",0.0124858694252721,0.995640847175597,13,30,"positive regulation of signal transduction by p53 class mediator","BP"
"2348","GO:0005095",0.0125174269593681,0.997627570717533,7,12,"GTPase inhibitor activity","MF"
"21355","GO:1990841",0.0125308658420812,0.993817617217514,25,67,"promoter-specific chromatin binding","MF"
"1093","GO:0002576",0.0125311889007307,0.998704247059952,5,7,"platelet degranulation","BP"
"12961","GO:0050900",0.0125423852815703,0.990830865573657,106,371,"leukocyte migration","BP"
"658","GO:0001906",0.0125674492154713,0.991613646571007,65,222,"cell killing","BP"
"5898","GO:0016798",0.012717100900049,0.992541087657845,40,121,"hydrolase activity, acting on glycosyl bonds","MF"
"5211","GO:0015217",0.0127477801729096,0.997966495706457,6,10,"ADP transmembrane transporter activity","MF"
"19936","GO:1903707",0.0127567895213208,0.992757512744695,36,107,"negative regulation of hemopoiesis","BP"
"10210","GO:0042176",0.0127575378939431,0.990696441494271,105,357,"regulation of protein catabolic process","BP"
"11443","GO:0045596",0.0127652495832387,0.9900067635203,171,612,"negative regulation of cell differentiation","BP"
"14426","GO:0061136",0.0127910843423583,0.991645293478299,60,192,"regulation of proteasomal protein catabolic process","BP"
"903","GO:0002277",0.0128042088507121,1,3,3,"myeloid dendritic cell activation involved in immune response","BP"
"4957","GO:0014015",0.0128279385125072,0.993640664636639,25,68,"positive regulation of gliogenesis","BP"
"11975","GO:0046640",0.0128340000073766,0.994713267140155,17,42,"regulation of alpha-beta T cell proliferation","BP"
"11634","GO:0045925",0.0128699177101237,1,3,3,"positive regulation of female receptivity","BP"
"9956","GO:0036503",0.0128907146415145,0.99262345224291,37,109,"ERAD pathway","BP"
"19111","GO:1901701",0.012926384201193,0.989284592885926,291,1079,"cellular response to oxygen-containing compound","BP"
"7709","GO:0031647",0.0129975686467357,0.990554522693495,102,349,"regulation of protein stability","BP"
"2240","GO:0004911",0.0130351888513339,1,3,3,"interleukin-2 receptor activity","MF"
"6542","GO:0019976",0.0130351888513339,1,3,3,"interleukin-2 binding","MF"
"12082","GO:0046902",0.0130594545960169,0.994102874802405,20,53,"regulation of mitochondrial membrane permeability","BP"
"3103","GO:0006511",0.0130763486794479,0.989712964173446,177,633,"ubiquitin-dependent protein catabolic process","BP"
"17827","GO:0110078",0.0131108095596107,1,3,3,"TTT Hsp90 cochaperone complex","CC"
"21640","GO:2000394",0.013239163794401,0.998609899296011,5,7,"positive regulation of lamellipodium morphogenesis","BP"
"17139","GO:0098552",0.0132808300681053,0.989467118575751,188,682,"side of membrane","CC"
"8490","GO:0032968",0.0134268865014765,0.994086673491864,19,49,"positive regulation of transcription elongation by RNA polymerase II","BP"
"7716","GO:0031664",0.0134822919991185,0.995784916029207,11,24,"regulation of lipopolysaccharide-mediated signaling pathway","BP"
"1070","GO:0002532",0.0135446361372121,0.992913316819355,28,80,"production of molecular mediator involved in inflammatory response","BP"
"925","GO:0002312",0.0135536158193988,0.992566868761659,32,93,"B cell activation involved in immune response","BP"
"11438","GO:0045588",0.0135721614150234,0.998564994263159,5,7,"positive regulation of gamma-delta T cell differentiation","BP"
"3956","GO:0008428",0.013609697944771,1,3,3,"ribonuclease inhibitor activity","MF"
"19121","GO:1901739",0.0136579565725629,0.996416580670325,9,18,"regulation of myoblast fusion","BP"
"5860","GO:0016740",0.0136847195534543,0.9880844488352,551,2101,"transferase activity","MF"
"6293","GO:0019243",0.0137049226804852,1,3,3,"methylglyoxal catabolic process to D-lactate via S-lactoyl-glutathione","BP"
"18790","GO:1900182",0.0137118762000718,0.99248373654042,32,92,"positive regulation of protein localization to nucleus","BP"
"12868","GO:0050769",0.0137138710439618,0.990606142228095,74,237,"positive regulation of neurogenesis","BP"
"1165","GO:0002703",0.0137414387653986,0.990605991249011,72,241,"regulation of leukocyte mediated immunity","BP"
"16424","GO:0090068",0.0137680844257395,0.990525808202573,75,246,"positive regulation of cell cycle process","BP"
"10359","GO:0042492",0.013834592521085,0.997319971655532,7,12,"gamma-delta T cell differentiation","BP"
"7074","GO:0030247",0.0138513571562464,0.995650741836637,11,24,"polysaccharide binding","MF"
"7187","GO:0030506",0.0138666543155243,0.996458515303543,9,17,"ankyrin binding","MF"
"7055","GO:0030220",0.0139849389413931,0.995673666254862,11,23,"platelet formation","BP"
"15357","GO:0070939",0.0140126585926846,1,3,3,"Dsl1/NZR complex","CC"
"351","GO:0001094",0.0140142694842332,0.997712690756691,6,10,"TFIID-class transcription factor complex binding","MF"
"9299","GO:0035166",0.0141054221334857,0.999148365649432,4,5,"post-embryonic hemopoiesis","BP"
"13101","GO:0051129",0.0141135052712632,0.988770643926443,191,684,"negative regulation of cellular component organization","BP"
"11256","GO:0045060",0.0141269480837364,0.997250733529605,7,12,"negative thymic T cell selection","BP"
"8421","GO:0032875",0.0142005022860172,1,3,3,"regulation of DNA endoreduplication","BP"
"20039","GO:1903899",0.0142282355859318,1,3,3,"positive regulation of PERK-mediated unfolded protein response","BP"
"3389","GO:0006921",0.0143273246135708,0.994898053553204,13,30,"cellular component disassembly involved in execution phase of apoptosis","BP"
"8655","GO:0033280",0.0143652884700456,0.994404639781962,15,36,"response to vitamin D","BP"
"16974","GO:0097411",0.0143707459733972,0.999126982916694,4,5,"hypoxia-inducible factor-1alpha signaling pathway","BP"
"2891","GO:0006139",0.014517271435754,0.986853525401125,1306,5210,"nucleobase-containing compound metabolic process","BP"
"15077","GO:0070391",0.0146558406909548,0.997581793938277,6,10,"response to lipoteichoic acid","BP"
"15478","GO:0071223",0.0146558406909548,0.997581793938277,6,10,"cellular response to lipoteichoic acid","BP"
"3002","GO:0006357",0.0146717661758525,0.987122055551881,618,2373,"regulation of transcription by RNA polymerase II","BP"
"20342","GO:1904466",0.0146883237562351,1,3,3,"positive regulation of matrix metallopeptidase secretion","BP"
"5425","GO:0015835",0.0147462225486312,1,3,3,"peptidoglycan transport","BP"
"14362","GO:0061024",0.0149211463418479,0.987938849153139,216,790,"membrane organization","BP"
"3718","GO:0008023",0.0149403950896215,0.993368401688954,19,48,"transcription elongation factor complex","CC"
"20669","GO:1905098",0.0149629971688127,0.999078751281639,4,5,"negative regulation of guanyl-nucleotide exchange factor activity","BP"
"17493","GO:0099507",0.0150243616087922,0.997036097528805,7,12,"ligand-gated monoatomic ion channel activity involved in regulation of presynaptic membrane potential","MF"
"3374","GO:0006897",0.0151296042205934,0.987947410098579,189,680,"endocytosis","BP"
"10355","GO:0042488",0.0151769846846149,1,3,3,"positive regulation of odontogenesis of dentin-containing tooth","BP"
"2078","GO:0004663",0.0152654550687499,0.999053856349808,4,5,"Rab geranylgeranyltransferase activity","MF"
"13937","GO:0060323",0.0152911171287163,0.993771075559311,16,39,"head morphogenesis","BP"
"2595","GO:0005615",0.0153492672657727,0.986397571717314,723,2889,"extracellular space","CC"
"20542","GO:1904861",0.0153959895443536,0.993764332992166,16,38,"excitatory synapse assembly","BP"
"3088","GO:0006487",0.0153962500385411,0.992096667118562,26,72,"protein N-linked glycosylation","BP"
"15721","GO:0071629",0.0154280088419231,1,3,3,"cytoplasm protein quality control by the ubiquitin-proteasome system","BP"
"14925","GO:0070141",0.015437106225514,0.99675808672296,7,13,"response to UV-A","BP"
"12533","GO:0048566",0.0154487742163281,0.994169628589905,14,33,"embryonic digestive tract development","BP"
"9794","GO:0036121",0.0154520607815667,1,3,3,"double-stranded DNA helicase activity","MF"
"7623","GO:0031460",0.015493829510018,1,3,3,"glycine betaine transport","BP"
"15090","GO:0070418",0.0155104087429823,0.999033565749726,4,5,"DNA-dependent protein kinase complex","CC"
"9300","GO:0035173",0.0155706350867541,0.989186645605409,77,245,"histone kinase activity","MF"
"907","GO:0002281",0.015579725751244,0.995708184109252,9,19,"macrophage activation involved in immune response","BP"
"18988","GO:1901329",0.0157259295431363,0.997360138438226,6,10,"regulation of odontoblast differentiation","BP"
"1022","GO:0002456",0.0158154942918992,0.990417712642655,42,131,"T cell mediated immunity","BP"
"1829","GO:0004307",0.0158683828819621,1,3,3,"ethanolaminephosphotransferase activity","MF"
"12939","GO:0050868",0.0158980775231096,0.99049547624992,40,124,"negative regulation of T cell activation","BP"
"8159","GO:0032469",0.0159181771188896,0.994549079839491,12,27,"endoplasmic reticulum calcium ion homeostasis","BP"
"19537","GO:1902850",0.0159541004886788,0.989789152225113,52,164,"microtubule cytoskeleton organization involved in mitosis","BP"
"13255","GO:0051403",0.0159764598209116,0.992650336760501,20,52,"stress-activated MAPK cascade","BP"
"12863","GO:0050764",0.0159839817802554,0.991087183601317,32,95,"regulation of phagocytosis","BP"
"19261","GO:1902117",0.0160503989507108,0.991188826318796,31,88,"positive regulation of organelle assembly","BP"
"4485","GO:0009896",0.0160753270963618,0.987548781149712,148,521,"positive regulation of catabolic process","BP"
"14745","GO:0061908",0.0160845625480995,1,3,3,"phagophore","CC"
"6854","GO:0022604",0.0161148331870184,0.988863460623793,74,238,"regulation of cell morphogenesis","BP"
"7090","GO:0030278",0.0161410437556019,0.990431468312559,39,118,"regulation of ossification","BP"
"297","GO:0000910",0.0161803804678399,0.989415278057264,57,180,"cytokinesis","BP"
"13526","GO:0051962",0.0162656068925905,0.988425588700824,86,282,"positive regulation of nervous system development","BP"
"16879","GO:0097202",0.0163088234885475,0.996533544250198,7,13,"activation of cysteine-type endopeptidase activity","BP"
"17409","GO:0099041",0.0163100034985892,0.998966541981018,4,5,"vesicle tethering to Golgi","BP"
"12904","GO:0050816",0.0163590407694979,1,3,3,"phosphothreonine residue binding","MF"
"21564","GO:2000297",0.0164056077667446,1,3,3,"negative regulation of synapse maturation","BP"
"17492","GO:0099505",0.0165877921438701,0.994356898497165,12,26,"regulation of presynaptic membrane potential","BP"
"12784","GO:0050508",0.0166113115401154,1,3,3,"glucuronosyl-N-acetylglucosaminyl-proteoglycan 4-alpha-N-acetylglucosaminyltransferase activity","MF"
"20147","GO:1904059",0.0166559785920571,1,3,3,"regulation of locomotor rhythm","BP"
"1168","GO:0002706",0.0166866458490991,0.989028355154531,57,187,"regulation of lymphocyte mediated immunity","BP"
"7890","GO:0032039",0.0167193811210838,0.995446073416624,9,18,"integrator complex","CC"
"3440","GO:0007010",0.0167303970857483,0.985729483991246,382,1429,"cytoskeleton organization","BP"
"1160","GO:0002698",0.0168171277438851,0.990052117997989,38,117,"negative regulation of immune effector process","BP"
"13973","GO:0060369",0.0168520978712404,0.998920426673569,4,5,"positive regulation of Fc receptor mediated stimulatory signaling pathway","BP"
"8420","GO:0032874",0.016900264411797,0.994924871903423,10,21,"positive regulation of stress-activated MAPK cascade","BP"
"15026","GO:0070304",0.016900264411797,0.994924871903423,10,21,"positive regulation of stress-activated protein kinase signaling cascade","BP"
"15049","GO:0070340",0.0169045471413695,1,3,3,"detection of bacterial lipopeptide","BP"
"6839","GO:0022402",0.0169231768207562,0.985724876072195,329,1232,"cell cycle process","BP"
"6693","GO:0021747",0.0169282279442922,1,3,3,"cochlear nucleus development","BP"
"13169","GO:0051252",0.016971627341441,0.984820436780793,861,3362,"regulation of RNA metabolic process","BP"
"7371","GO:0030948",0.0170328234523292,0.99708401050856,6,10,"negative regulation of vascular endothelial growth factor receptor signaling pathway","BP"
"18112","GO:0140296",0.0170424646079706,0.992073557525404,20,53,"general transcription initiation factor binding","MF"
"11530","GO:0045732",0.0171040343703446,0.98850729854465,63,204,"positive regulation of protein catabolic process","BP"
"7091","GO:0030279",0.0171231043900482,0.993124479566966,15,37,"negative regulation of ossification","BP"
"3607","GO:0007346",0.0172154787876312,0.986762340394778,137,484,"regulation of mitotic cell cycle","BP"
"11516","GO:0045687",0.0172748553575213,0.992579112925541,17,43,"positive regulation of glial cell differentiation","BP"
"17363","GO:0098944",0.0172953044303405,0.998882325563034,4,5,"postsynaptic recycling endosome membrane","CC"
"12812","GO:0050654",0.0173251007252179,0.993656956443594,13,30,"chondroitin sulfate proteoglycan metabolic process","BP"
"11430","GO:0045579",0.0173271012591308,0.995653631622295,8,16,"positive regulation of B cell differentiation","BP"
"19210","GO:1902003",0.0173343387893393,0.993076531410525,15,36,"regulation of amyloid-beta formation","BP"
"7149","GO:0030371",0.0173532375973872,0.993343448129008,14,33,"translation repressor activity","MF"
"394","GO:0001503",0.0174419985890377,0.986878145938968,117,408,"ossification","BP"
"930","GO:0002317",0.0174527794288766,0.997623095913101,5,8,"plasma cell differentiation","BP"
"11964","GO:0046629",0.0175405642690717,0.994277070022745,11,24,"gamma-delta T cell activation","BP"
"6514","GO:0019903",0.017550487672616,0.989113582812411,45,138,"protein phosphatase binding","MF"
"15773","GO:0071705",0.0175643550613861,0.984773944027855,473,1806,"nitrogen compound transport","BP"
"15228","GO:0070670",0.0176380439729996,0.992889469276266,15,37,"response to interleukin-4","BP"
"18476","GO:0141187",0.0178031019476737,0.983950508083349,1032,4079,"nucleic acid biosynthetic process","BP"
"20516","GO:1904813",0.0178349361172118,0.989317719564791,39,121,"ficolin-1-rich granule lumen","CC"
"1249","GO:0002832",0.0178485967688235,0.989481152873595,37,113,"negative regulation of response to biotic stimulus","BP"
"12267","GO:0047756",0.0178703807531019,1,3,3,"chondroitin 4-sulfotransferase activity","MF"
"19815","GO:1903432",0.017945178668731,0.989921934257735,32,93,"regulation of TORC1 signaling","BP"
"11489","GO:0045651",0.0179665186869415,0.995460198910036,8,16,"positive regulation of macrophage differentiation","BP"
"9712","GO:0035979",0.0180342032078637,1,3,3,"histone H2AXS139 kinase activity","MF"
"250","GO:0000768",0.0180490821071668,0.991371318008582,21,56,"syncytium formation by plasma membrane fusion","BP"
"18094","GO:0140253",0.0180490821071668,0.991371318008582,21,56,"cell-cell fusion","BP"
"12771","GO:0050435",0.0180522977582923,0.991580131398916,20,52,"amyloid-beta metabolic process","BP"
"9102","GO:0034511",0.0180817525105813,0.996858257749181,6,10,"U3 snoRNA binding","MF"
"6525","GO:0019941",0.0182653179569099,0.985454548015198,178,643,"modification-dependent protein catabolic process","BP"
"21545","GO:2000271",0.0183523102265977,0.996799449644103,6,10,"positive regulation of fibroblast apoptotic process","BP"
"12865","GO:0050766",0.0183717744539013,0.990644576713528,24,68,"positive regulation of phagocytosis","BP"
"4073","GO:0008637",0.0183774638953324,0.989494749025182,33,101,"apoptotic mitochondrial changes","BP"
"3425","GO:0006984",0.0184491762424327,0.99178263895179,18,46,"ER-nucleus signaling pathway","BP"
"4401","GO:0009595",0.0184684674527872,0.992795446180908,14,34,"detection of biotic stimulus","BP"
"18050","GO:0140096",0.0184943375396763,0.983796710223076,554,2117,"catalytic activity, acting on a protein","MF"
"21438","GO:2000058",0.0187012491959383,0.987900253186034,52,165,"regulation of ubiquitin-dependent protein catabolic process","BP"
"14154","GO:0060628",0.0187361627371785,0.996715616952954,6,10,"regulation of ER to Golgi vesicle-mediated transport","BP"
"4413","GO:0009628",0.0188376393234994,0.984242574961808,288,1072,"response to abiotic stimulus","BP"
"8012","GO:0032271",0.0188592308731852,0.987389276000014,60,193,"regulation of protein polymerization","BP"
"9596","GO:0035754",0.0188798083206506,0.997371466622359,5,8,"B cell chemotaxis","BP"
"4942","GO:0012506",0.0188881891857215,0.98405035834083,322,1207,"vesicle membrane","CC"
"6932","GO:0030030",0.018909912294803,0.983743837667179,410,1533,"cell projection organization","BP"
"11398","GO:0045445",0.0189111481770265,0.988912182738734,36,108,"myoblast differentiation","BP"
"2706","GO:0005833",0.0190329091100236,0.997044961467032,5,9,"hemoglobin complex","CC"
"18255","GO:0140677",0.0193315049627962,0.983897740399303,270,1027,"molecular function activator activity","MF"
"64","GO:0000139",0.0194139732335144,0.984444615293879,185,665,"Golgi membrane","CC"
"8367","GO:0032786",0.0194245726902053,0.99060840835814,21,57,"positive regulation of DNA-templated transcription, elongation","BP"
"10351","GO:0042481",0.0194393845903815,0.994420026985508,9,19,"regulation of odontogenesis","BP"
"5975","GO:0016922",0.019460962178873,0.987985517589843,43,131,"nuclear receptor binding","MF"
"17900","GO:0120103",0.0195464245048603,0.996537144909451,6,10,"centriolar subdistal appendage","CC"
"10267","GO:0042327",0.0195559399901281,0.985044482102066,127,445,"positive regulation of phosphorylation","BP"
"11479","GO:0045637",0.0195815457956394,0.986894304415233,59,195,"regulation of myeloid cell differentiation","BP"
"10717","GO:0043236",0.0196900606188575,0.993030791025488,12,27,"laminin binding","MF"
"5269","GO:0015377",0.0196920337634375,0.993925602215453,10,21,"chloride:monoatomic cation symporter activity","MF"
"16241","GO:0072687",0.0198095289815408,0.994894340426962,8,16,"meiotic spindle","CC"
"10948","GO:0043632",0.019810904653378,0.984168924940521,179,648,"modification-dependent macromolecule catabolic process","BP"
"1052","GO:0002504",0.0198988870660531,0.992097516945299,14,35,"antigen processing and presentation of peptide or polysaccharide antigen via MHC class II","BP"
"5246","GO:0015296",0.0200173916999528,0.993324705070686,11,24,"monoatomic anion:monoatomic cation symporter activity","MF"
"4696","GO:0010638",0.0201559018133742,0.98434597331077,141,500,"positive regulation of organelle organization","BP"
"11201","GO:0044837",0.0202943012873197,0.996370629619782,6,10,"actomyosin contractile ring organization","BP"
"7038","GO:0030203",0.0203167826586876,0.988018719394627,36,108,"glycosaminoglycan metabolic process","BP"
"3403","GO:0006949",0.0204106016176618,0.989889124698213,22,60,"syncytium formation","BP"
"6824","GO:0022008",0.0204403069568399,0.982308831485015,441,1659,"neurogenesis","BP"
"3581","GO:0007272",0.0204686171224504,0.986816146448114,50,156,"ensheathment of neurons","BP"
"3917","GO:0008366",0.0204686171224504,0.986816146448114,50,156,"axon ensheathment","BP"
"5450","GO:0015868",0.0205091162118149,0.991879607488085,14,34,"purine ribonucleotide transport","BP"
"5624","GO:0016235",0.0205743139040068,0.99185010498756,14,34,"aggresome","CC"
"21096","GO:1990166",0.020596217946417,0.99464918097211,8,16,"protein localization to site of double-strand break","BP"
"16530","GO:0090224",0.0206179643804752,0.990650198744499,18,47,"regulation of spindle organization","BP"
"4511","GO:0009986",0.0207326981375574,0.982991754552422,226,834,"cell surface","CC"
"9854","GO:0036293",0.0207458144027101,0.984996674509545,87,295,"response to decreased oxygen levels","BP"
"330","GO:0000987",0.0207658956375501,0.982549703386978,295,1097,"cis-regulatory region sequence-specific DNA binding","MF"
"17215","GO:0098698",0.0210021914652966,0.991722069814885,14,33,"postsynaptic specialization assembly","BP"
"1240","GO:0002823",0.0211843731870854,0.989627461222823,21,58,"negative regulation of adaptive immune response based on somatic recombination of immune receptors built from immunoglobulin superfamily domains","BP"
"4117","GO:0008821",0.0211897479968231,0.996951953933432,5,8,"crossover junction DNA endonuclease activity","MF"
"13115","GO:0051146",0.0212026017220864,0.984759067350618,84,279,"striated muscle cell differentiation","BP"
"15611","GO:0071453",0.0213947921371075,0.986162218375485,50,158,"cellular response to oxygen levels","BP"
"8359","GO:0032774",0.0214406446684795,0.980634198109973,1004,3971,"RNA biosynthetic process","BP"
"11570","GO:0045807",0.0215041660979277,0.986272718482217,47,150,"positive regulation of endocytosis","BP"
"11974","GO:0046639",0.0215050373331644,0.992194289935443,12,28,"negative regulation of alpha-beta T cell differentiation","BP"
"17467","GO:0099175",0.0215181305397134,0.986315531055437,47,144,"regulation of postsynapse organization","BP"
"21850","GO:2000725",0.0215525476038776,0.99434834922569,8,16,"regulation of cardiac muscle cell differentiation","BP"
"10823","GO:0043405",0.0217030757769548,0.987009046062143,37,113,"regulation of MAP kinase activity","BP"
"7048","GO:0030213",0.0218333575514909,0.995047654322861,7,13,"hyaluronan biosynthetic process","BP"
"5962","GO:0016894",0.022090040949923,0.994013638552726,8,17,"endonuclease activity, active with either ribo- or deoxyribonucleic acids and producing 3'-phosphomonoesters","MF"
"5871","GO:0016757",0.0221299258839059,0.984400638708941,74,247,"glycosyltransferase activity","MF"
"4944","GO:0012510",0.0222035567830636,0.993464219084848,9,19,"trans-Golgi network transport vesicle membrane","CC"
"8327","GO:0032728",0.0222062192593921,0.990446081215797,16,40,"positive regulation of interferon-beta production","BP"
"7577","GO:0031396",0.0222279080542713,0.985012395038862,59,194,"regulation of protein ubiquitination","BP"
"5541","GO:0016070",0.0222320809984869,0.979878090517688,1048,4150,"RNA metabolic process","BP"
"17145","GO:0098562",0.0222435805723252,0.984860529600233,62,202,"cytoplasmic side of membrane","CC"
"9855","GO:0036294",0.0222457911428525,0.985862735552731,46,144,"cellular response to decreased oxygen levels","BP"
"13372","GO:0051649",0.0222799245205726,0.980524405221836,499,1910,"establishment of localization in cell","BP"
"8331","GO:0032732",0.0223169923267102,0.988586783925721,23,65,"positive regulation of interleukin-1 production","BP"
"12917","GO:0050840",0.0223567965343733,0.988620985300437,23,63,"extracellular matrix binding","MF"
"13084","GO:0051101",0.0223645747290864,0.98835426067392,24,69,"regulation of DNA binding","BP"
"5111","GO:0015031",0.0224821535540289,0.980762908717757,361,1364,"protein transport","BP"
"9050","GO:0034405",0.0225281797438669,0.990959332998727,14,34,"response to fluid shear stress","BP"
"7254","GO:0030660",0.0225491785538483,0.989134634219476,20,54,"Golgi-associated vesicle membrane","CC"
"10665","GO:0043161",0.0225778820877033,0.982679774426269,124,438,"proteasome-mediated ubiquitin-dependent protein catabolic process","BP"
"6716","GO:0021782",0.0225993379500711,0.985953146007652,42,130,"glial cell development","BP"
"13524","GO:0051960",0.022602053062719,0.982660119383205,125,432,"regulation of nervous system development","BP"
"21990","GO:2001057",0.0227365215257154,0.987478448831922,28,82,"reactive nitrogen species metabolic process","BP"
"7119","GO:0030316",0.0227508611510933,0.986658510946907,34,103,"osteoclast differentiation","BP"
"21807","GO:2000646",0.0227632993338776,0.996657973394763,5,8,"positive regulation of receptor catabolic process","BP"
"3314","GO:0006796",0.022795471436181,0.979902629062127,573,2222,"phosphate-containing compound metabolic process","BP"
"8416","GO:0032869",0.0228914477104696,0.984447377949688,61,198,"cellular response to insulin stimulus","BP"
