"","category","over_represented_pvalue","under_represented_pvalue","numDEInCat","numInCat","term","ontology"
"10830","GO:0043413",0.00366032649378228,0.997682134044907,71,218,"macromolecule glycosylation","BP"
"7582","GO:0031401",0.00368920197297406,0.997239197624046,166,571,"positive regulation of protein modification process","BP"
"10147","GO:0042023",0.00368941450501349,1,4,4,"DNA endoreduplication","BP"
"20008","GO:1903829",0.00369755130768855,0.997306980387202,140,470,"positive regulation of protein localization","BP"
"16034","GO:0072197",0.00373169956033786,0.999814723228774,5,6,"ureter morphogenesis","BP"
"9636","GO:0035821",0.00375154211092424,0.999267643827923,9,16,"modulation of process of another organism","BP"
"11396","GO:0045429",0.00377722290464837,0.998686742738905,17,38,"positive regulation of nitric oxide biosynthetic process","BP"
"2105","GO:0004707",0.00381360653578577,0.999289399615212,9,15,"MAP kinase activity","MF"
"15103","GO:0070434",0.00385516954801576,0.999806946885946,5,6,"positive regulation of nucleotide-binding oligomerization domain containing 2 signaling pathway","BP"
"11255","GO:0045059",0.003889672502715,0.999272771963438,9,15,"positive thymic T cell selection","BP"
"15300","GO:0070841",0.00389895632366265,0.998900860364876,13,26,"inclusion body assembly","BP"
"12825","GO:0050672",0.00391472492818845,0.998097685159393,31,84,"negative regulation of lymphocyte proliferation","BP"
"965","GO:0002367",0.00396344405126111,0.9978541776529,41,117,"cytokine production involved in immune response","BP"
"17206","GO:0098686",0.00396570373585675,0.998519583094785,19,43,"hippocampal mossy fiber to CA3 synapse","CC"
"10907","GO:0043547",0.00398094707180241,0.997752520537027,47,133,"positive regulation of GTPase activity","BP"
"4611","GO:0010468",0.00398779141066982,0.996464916482495,1150,4501,"regulation of gene expression","BP"
"3074","GO:0006468",0.00399121414074425,0.996776197294809,301,1081,"protein phosphorylation","BP"
"8269","GO:0032640",0.00403522147500234,0.997635306003776,52,156,"tumor necrosis factor production","BP"
"8297","GO:0032680",0.00403522147500234,0.997635306003776,52,156,"regulation of tumor necrosis factor production","BP"
"18605","GO:0160075",0.00404239706084896,1,4,4,"non-canonical inflammasome complex assembly","BP"
"19123","GO:1901741",0.00421785849596143,0.999301635742947,8,13,"positive regulation of myoblast fusion","BP"
"5630","GO:0016242",0.00423585193395687,0.998521301477036,17,37,"negative regulation of macroautophagy","BP"
"4641","GO:0010556",0.00427231292722471,0.996205924974007,1178,4619,"regulation of macromolecule biosynthetic process","BP"
"10360","GO:0042494",0.00427555286348642,1,4,4,"detection of bacterial lipoprotein","BP"
"3583","GO:0007275",0.00429858737864465,0.996188850439761,1129,4384,"multicellular organism development","BP"
"14903","GO:0070098",0.00438539858037795,0.997861571094286,30,85,"chemokine-mediated signaling pathway","BP"
"617","GO:0001836",0.00440538816574269,0.99820000853272,21,53,"release of cytochrome c from mitochondria","BP"
"5481","GO:0015923",0.00441865088342237,0.999155546502895,9,15,"mannosidase activity","MF"
"7541","GO:0031326",0.00443083012765883,0.996060896902712,1198,4703,"regulation of cellular biosynthetic process","BP"
"2984","GO:0006308",0.00448836897440568,0.998606288134366,14,30,"DNA catabolic process","BP"
"12038","GO:0046824",0.00449203036597419,0.998007360598477,25,63,"positive regulation of nucleocytoplasmic transport","BP"
"19158","GO:1901873",0.00454610702620888,0.997036288640281,76,242,"regulation of post-translational protein modification","BP"
"8508","GO:0032991",0.0045516893291786,0.99593726171732,1333,5298,"protein-containing complex","CC"
"13949","GO:0060337",0.00456188201007665,0.997854282615663,28,74,"type I interferon-mediated signaling pathway","BP"
"20340","GO:1904464",0.00456421451230659,0.999760987595046,5,6,"regulation of matrix metallopeptidase secretion","BP"
"21317","GO:1990773",0.00456421451230659,0.999760987595046,5,6,"matrix metallopeptidase secretion","BP"
"4478","GO:0009889",0.00456988917813824,0.995933504379757,1216,4780,"regulation of biosynthetic process","BP"
"4568","GO:0010269",0.00457788789963446,0.999352464299799,7,11,"response to selenium ion","BP"
"8486","GO:0032964",0.004611290354098,0.998228575768754,19,45,"collagen biosynthetic process","BP"
"15697","GO:0071596",0.00466946019567949,1,4,4,"ubiquitin-dependent protein catabolic process via the N-end rule pathway","BP"
"17040","GO:0097530",0.00468215386376466,0.997323518126405,46,140,"granulocyte migration","BP"
"17327","GO:0098895",0.00471382234436032,0.99956401637619,6,8,"postsynaptic endosome membrane","CC"
"3735","GO:0008063",0.00471562790143336,0.999202789287567,8,13,"Toll signaling pathway","BP"
"569","GO:0001782",0.00472300111767292,0.998385605854978,16,35,"B cell homeostasis","BP"
"12925","GO:0050854",0.00474381999857275,0.997839595861433,26,67,"regulation of antigen receptor-mediated signaling pathway","BP"
"10446","GO:0042692",0.00477939626432017,0.996595156331353,117,384,"muscle cell differentiation","BP"
"1028","GO:0002467",0.00480912584166569,0.999183983492613,8,13,"germinal center formation","BP"
"3009","GO:0006366",0.00481393173697558,0.995841120832829,654,2488,"transcription by RNA polymerase II","BP"
"945","GO:0002335",0.00487452046515742,0.998312061639325,16,36,"mature B cell differentiation","BP"
"17416","GO:0099068",0.00487952207722873,0.99757245093413,32,84,"postsynapse assembly","BP"
"11976","GO:0046641",0.00490894468395953,0.998650388239353,12,24,"positive regulation of alpha-beta T cell proliferation","BP"
"8260","GO:0032623",0.00493611662731003,0.997784701296603,25,64,"interleukin-2 production","BP"
"8288","GO:0032663",0.00493611662731003,0.997784701296603,25,64,"regulation of interleukin-2 production","BP"
"917","GO:0002294",0.00497194402541339,0.997575979884601,30,80,"CD4-positive, alpha-beta T cell differentiation involved in immune response","BP"
"1162","GO:0002700",0.00498231141326514,0.996948794388528,58,179,"regulation of production of molecular mediator of immune response","BP"
"7559","GO:0031346",0.00498868467008504,0.996499472843234,107,346,"positive regulation of cell projection organization","BP"
"3466","GO:0007052",0.00499980622127801,0.997164086848266,45,131,"mitotic spindle organization","BP"
"17256","GO:0098791",0.0050002517767391,0.996445967462473,114,377,"Golgi apparatus subcompartment","CC"
"6513","GO:0019902",0.00501322006814471,0.996909439142062,60,181,"phosphatase binding","MF"
"4164","GO:0009059",0.00507498638724799,0.995446115054386,1550,6182,"macromolecule biosynthetic process","BP"
"10798","GO:0043374",0.00507783646400002,0.999129533210139,8,13,"CD8-positive, alpha-beta T cell differentiation","BP"
"4070","GO:0008630",0.00508308733767005,0.997296606584676,37,105,"intrinsic apoptotic signaling pathway in response to DNA damage","BP"
"15259","GO:0070727",0.00508833685084877,0.995602745587205,648,2462,"cellular macromolecule localization","BP"
"17267","GO:0098802",0.00511252518925111,0.996873775967965,58,174,"plasma membrane signaling receptor complex","CC"
"5664","GO:0016310",0.00512206832573291,0.99577720909394,350,1278,"phosphorylation","BP"
"7058","GO:0030223",0.00512848040341131,0.999257485959802,7,11,"neutrophil differentiation","BP"
"915","GO:0002292",0.0051314262146955,0.997421893942481,32,87,"T cell differentiation involved in immune response","BP"
"17155","GO:0098591",0.00514900452229198,0.999721524976042,5,6,"external side of apical plasma membrane","CC"
"19846","GO:1903510",0.00515894967481349,0.99738117928265,33,89,"mucopolysaccharide metabolic process","BP"
"18745","GO:1900102",0.00518264847692596,0.998930889165256,9,16,"negative regulation of endoplasmic reticulum unfolded protein response","BP"
"13163","GO:0051246",0.00519739578104547,0.995588435873928,493,1867,"regulation of protein metabolic process","BP"
"20311","GO:1904407",0.0052139817882826,0.998105263657729,17,39,"positive regulation of nitric oxide metabolic process","BP"
"2564","GO:0005575",0.00524222929684457,0.996212531845839,3930,16395,"cellular_component","CC"
"1013","GO:0002443",0.00532841181701261,0.996207239378306,112,383,"leukocyte mediated immunity","BP"
"18521","GO:0150052",0.00542661253101341,0.997892172307291,19,44,"regulation of postsynapse assembly","BP"
"11968","GO:0046633",0.00543837425066032,0.997874173658714,19,45,"alpha-beta T cell proliferation","BP"
"21346","GO:1990830",0.00544800771087654,0.99721793494533,33,90,"cellular response to leukemia inhibitory factor","BP"
"19254","GO:1902106",0.00551132191316761,0.997079653517484,36,102,"negative regulation of leukocyte differentiation","BP"
"17153","GO:0098588",0.00551630231298723,0.995269205000364,563,2135,"bounding membrane of organelle","CC"
"13216","GO:0051336",0.0055193981766703,0.99584687757623,157,550,"regulation of hydrolase activity","BP"
"10807","GO:0043383",0.0055410853621527,0.999034312256747,8,13,"negative T cell selection","BP"
"5602","GO:0016192",0.00558815436913131,0.99532042834802,409,1518,"vesicle-mediated transport","BP"
"12923","GO:0050852",0.00559677724545927,0.996736117005281,48,142,"T cell receptor signaling pathway","BP"
"8602","GO:0033157",0.00561253299300116,0.99670716640641,49,145,"regulation of intracellular protein transport","BP"
"16232","GO:0072676",0.00562509056319906,0.997010826013774,36,103,"lymphocyte migration","BP"
"3575","GO:0007266",0.0056980367353018,0.996722868051736,46,133,"Rho protein signal transduction","BP"
"15557","GO:0071357",0.00572188153671458,0.997250770514665,28,75,"cellular response to type I interferon","BP"
"11106","GO:0044380",0.00578658457108094,0.997334925042244,26,65,"protein localization to cytoskeleton","BP"
"3756","GO:0008104",0.00580008077817064,0.994978779137174,644,2450,"protein localization","BP"
"21582","GO:2000318",0.00581847698841991,0.998651047751333,10,18,"positive regulation of T-helper 17 type immune response","BP"
"8476","GO:0032945",0.00582184440084898,0.997070872593398,31,86,"negative regulation of mononuclear cell proliferation","BP"
"3465","GO:0007051",0.00582660486133904,0.996310857601766,64,199,"spindle organization","BP"
"2688","GO:0005794",0.00588240956237236,0.995053528238896,425,1581,"Golgi apparatus","CC"
"16982","GO:0097431",0.0059009400344591,0.997825153720587,17,39,"mitotic spindle pole","CC"
"13401","GO:0051712",0.00596698449458601,0.999290671730468,6,9,"positive regulation of killing of cells of another organism","BP"
"1180","GO:0002718",0.00601709397948107,0.996669361109365,40,116,"regulation of cytokine production involved in immune response","BP"
"8897","GO:0034134",0.0060183813045355,0.998725824929272,9,16,"toll-like receptor 2 signaling pathway","BP"
"912","GO:0002287",0.00609766137050447,0.996971455999955,30,81,"alpha-beta T cell activation involved in immune response","BP"
"916","GO:0002293",0.00609766137050447,0.996971455999955,30,81,"alpha-beta T cell differentiation involved in immune response","BP"
"8682","GO:0033365",0.00619033660250247,0.995005979105887,268,971,"protein localization to organelle","BP"
"17191","GO:0098657",0.00625166259894236,0.995002635580177,246,882,"import into cell","BP"
"3958","GO:0008430",0.00640234732674047,0.999226393695356,6,9,"selenium binding","MF"
"9881","GO:0036336",0.00641149002971488,0.99789121442502,14,31,"dendritic cell migration","BP"
"8091","GO:0032386",0.00641464282803172,0.995701633193696,80,256,"regulation of intracellular transport","BP"
"13121","GO:0051152",0.00642551722860639,0.998623942270652,9,16,"positive regulation of smooth muscle cell differentiation","BP"
"8962","GO:0034244",0.00644703447362822,0.99843053721485,10,19,"negative regulation of transcription elongation by RNA polymerase II","BP"
"6277","GO:0019219",0.00653486052497757,0.994217390753888,940,3654,"regulation of nucleobase-containing compound metabolic process","BP"
"9952","GO:0036499",0.00658616833314391,0.998391076384871,10,19,"PERK-mediated unfolded protein response","BP"
"7581","GO:0031400",0.00663382022641087,0.995384658408523,95,314,"negative regulation of protein modification process","BP"
"8425","GO:0032879",0.00667300500938222,0.994302407112154,503,1897,"regulation of localization","BP"
"2484","GO:0005344",0.00673419876985533,0.99907518985223,6,10,"oxygen carrier activity","MF"
"10169","GO:0042093",0.0067690237449014,0.996654188879869,29,78,"T-helper cell differentiation","BP"
"11950","GO:0046605",0.00686725142050821,0.997010833930679,22,55,"regulation of centrosome cycle","BP"
"1574","GO:0003712",0.00692502368435491,0.994799481543288,148,508,"transcription coregulator activity","MF"
"16436","GO:0090084",0.00695090311695113,0.998927834647369,7,11,"negative regulation of inclusion body assembly","BP"
"1976","GO:0004520",0.00698926583260072,0.997354270363945,17,40,"DNA endonuclease activity","MF"
"3000","GO:0006355",0.00705999280187138,0.99379134857781,806,3112,"regulation of DNA-templated transcription","BP"
"2350","GO:0005102",0.00706795323538444,0.994118833404642,355,1343,"signaling receptor binding","MF"
"21790","GO:2000629",0.00709294826497963,0.997663246780851,14,30,"negative regulation of miRNA metabolic process","BP"
"2700","GO:0005819",0.0071273699124284,0.994806148863631,121,411,"spindle","CC"
"14029","GO:0060438",0.00712758242894197,0.998236156138998,10,19,"trachea development","BP"
"5957","GO:0016889",0.00720258090777443,0.999105447340512,6,9,"DNA endonuclease activity, producing 3'-phosphomonoesters","MF"
"8970","GO:0034260",0.007254364147441,0.998199573707911,10,19,"negative regulation of GTPase activity","BP"
"7026","GO:0030185",0.00725516780528165,0.999646351075689,4,5,"nitric oxide transport","BP"
"13364","GO:0051640",0.00725712503973278,0.994431988730876,170,594,"organelle localization","BP"
"19643","GO:1903050",0.00740914097540563,0.995109118435027,72,231,"regulation of proteolysis involved in protein catabolic process","BP"
"11055","GO:0044249",0.00745564567503923,0.993268741447319,1675,6717,"cellular biosynthetic process","BP"
"5878","GO:0016773",0.00746889315506225,0.994197119710608,187,646,"phosphotransferase activity, alcohol group as acceptor","MF"
"2349","GO:0005096",0.00747590554928487,0.994948228686164,81,255,"GTPase activator activity","MF"
"13119","GO:0051150",0.00751004268376968,0.997261794573579,16,36,"regulation of smooth muscle cell differentiation","BP"
"900","GO:0002274",0.0075345832761116,0.995047967206131,70,227,"myeloid leukocyte activation","BP"
"11432","GO:0045581",0.00754381763308871,0.996912240387551,19,47,"negative regulation of T cell differentiation","BP"
"2697","GO:0005814",0.00755773887579251,0.995402232541046,52,157,"centriole","CC"
"2996","GO:0006351",0.00756168521799452,0.99333176829998,834,3231,"DNA-templated transcription","BP"
"12573","GO:0048646",0.00758438279513032,0.993769671679444,306,1114,"anatomical structure formation involved in morphogenesis","BP"
"12405","GO:0048248",0.00761600143415904,0.999623049155815,4,5,"CXCR3 chemokine receptor binding","MF"
"5877","GO:0016772",0.00764896058413417,0.993874714802869,239,848,"transferase activity, transferring phosphorus-containing groups","MF"
"10882","GO:0043517",0.00766153261921992,0.998242114900459,9,17,"positive regulation of DNA damage response, signal transduction by p53 class mediator","BP"
"19648","GO:1903055",0.00772904427015052,0.997424605888115,14,30,"positive regulation of extracellular matrix organization","BP"
"8745","GO:0033599",0.0077838976257028,0.998461374480687,8,14,"regulation of mammary gland epithelial cell proliferation","BP"
"19213","GO:1902017",0.00784203753017628,0.996195792705333,27,71,"regulation of cilium assembly","BP"
"1238","GO:0002821",0.00801679271209054,0.995325855970933,44,132,"positive regulation of adaptive immune response","BP"
"4550","GO:0010172",0.00801815939093476,0.998725207024058,7,11,"embryonic body morphogenesis","BP"
"8330","GO:0032731",0.00817766521371691,0.996350733944778,22,57,"positive regulation of interleukin-1 beta production","BP"
"5743","GO:0016493",0.00821508043416661,0.99766348073988,11,23,"C-C chemokine receptor activity","MF"
"8258","GO:0032620",0.00823423553800716,0.99691568999398,16,38,"interleukin-17 production","BP"
"8286","GO:0032660",0.00823423553800716,0.99691568999398,16,38,"regulation of interleukin-17 production","BP"
"18731","GO:1900076",0.00832562170095242,0.995992428550244,26,69,"regulation of cellular response to insulin stimulus","BP"
"10172","GO:0042101",0.00833687407109724,0.998058392953049,9,17,"T cell receptor complex","CC"
"13118","GO:0051149",0.00838868479526059,0.996107701988707,24,62,"positive regulation of muscle cell differentiation","BP"
"8231","GO:0032588",0.00841711163982626,0.995311938809675,38,109,"trans-Golgi network membrane","CC"
"21112","GO:1990226",0.00843071551201486,0.998307699490344,8,14,"histone methyltransferase binding","MF"
"4409","GO:0009615",0.00849536458004583,0.993822116203556,114,392,"response to virus","BP"
"10492","GO:0042771",0.00853960245624216,0.996457115823414,19,47,"intrinsic apoptotic signaling pathway in response to DNA damage by p53 class mediator","BP"
"22010","GO:2001141",0.00861679729414512,0.992397496609037,809,3131,"regulation of RNA biosynthetic process","BP"
"13818","GO:0060142",0.00862569512390659,0.9973409893007,12,26,"regulation of syncytium formation by plasma membrane fusion","BP"
"19750","GO:1903320",0.0087618084620326,0.994144655383194,73,237,"regulation of protein modification by small protein conjugation or removal","BP"
"11562","GO:0045787",0.00878792199539608,0.993773155123113,98,327,"positive regulation of cell cycle","BP"
"16581","GO:0090304",0.00879225847852188,0.992116473920237,1183,4672,"nucleic acid metabolic process","BP"
"7554","GO:0031341",0.00880053206349013,0.995192248426479,35,103,"regulation of cell killing","BP"
"11888","GO:0046488",0.00880214710364199,0.994749442556761,47,139,"phosphatidylinositol metabolic process","BP"
"10099","GO:0039531",0.00881252817803142,0.994990873464902,40,116,"regulation of cytoplasmic pattern recognition receptor signaling pathway","BP"
"89","GO:0000209",0.00886679671705455,0.993979386600515,79,254,"protein polyubiquitination","BP"
"869","GO:0002220",0.00888916238255619,0.995364597943546,31,87,"innate immune response activating cell surface receptor signaling pathway","BP"
"8093","GO:0032388",0.00890437241760956,0.994748002477691,45,133,"positive regulation of intracellular transport","BP"
"7039","GO:0030204",0.00894753081139553,0.997268918170281,12,25,"chondroitin sulfate metabolic process","BP"
"6423","GO:0019724",0.00898419613187086,0.994751473530686,43,130,"B cell mediated immunity","BP"
"6984","GO:0030130",0.0091263909162117,0.997840010837887,9,17,"clathrin coat of trans-Golgi network vesicle","CC"
"4797","GO:0010804",0.00913492177101338,0.997160221621389,12,26,"negative regulation of tumor necrosis factor-mediated signaling pathway","BP"
"14380","GO:0061043",0.00925360621253434,0.998356325943119,7,12,"regulation of vascular wound healing","BP"
"15497","GO:0071260",0.009300976202845,0.995396774059349,27,73,"cellular response to mechanical stimulus","BP"
"13162","GO:0051241",0.00941644365684699,0.992292868989667,277,1023,"negative regulation of multicellular organismal process","BP"
"11961","GO:0046626",0.00944368645054295,0.995554626184122,24,63,"regulation of insulin receptor signaling pathway","BP"
"9886","GO:0036344",0.00946499893627717,0.997086807388752,12,25,"platelet morphogenesis","BP"
"7519","GO:0031272",0.00957962738494227,0.998285860346044,7,12,"regulation of pseudopodium assembly","BP"
"7520","GO:0031274",0.00957962738494227,0.998285860346044,7,12,"positive regulation of pseudopodium assembly","BP"
"19554","GO:1902894",0.00958443833167672,0.996850687522205,13,28,"negative regulation of miRNA transcription","BP"
"2083","GO:0004672",0.00961240198216243,0.992630459287679,159,543,"protein kinase activity","MF"
"1241","GO:0002824",0.00961369830876375,0.994400286085991,42,126,"positive regulation of adaptive immune response based on somatic recombination of immune receptors built from immunoglobulin superfamily domains","BP"
"14694","GO:0061809",0.00971574096936099,0.997995227917454,8,14,"NAD+ nucleotidase, cyclic ADP-ribose generating","MF"
"19879","GO:1903561",0.00978512765304757,0.991570791932157,511,1983,"extracellular vesicle","CC"
"5327","GO:0015669",0.00981603037377128,0.99779736752147,8,16,"gas transport","BP"
"8541","GO:0033036",0.00987237838068781,0.991304612457842,749,2892,"macromolecule localization","BP"
"3511","GO:0007162",0.00992410154279849,0.993099891630747,86,284,"negative regulation of cell adhesion","BP"
"16549","GO:0090261",0.00996709321023983,0.999462591083855,4,5,"positive regulation of inclusion body assembly","BP"
"20596","GO:1904951",0.00997956892970435,0.992958355072366,93,308,"positive regulation of establishment of protein localization","BP"
"17136","GO:0098543",0.0100074024856981,0.99759202118271,9,17,"detection of other organism","BP"
"18113","GO:0140297",0.0100467294313475,0.992462092925339,134,462,"DNA-binding transcription factor binding","MF"
"5091","GO:0014902",0.0100472512440589,0.994235477446298,40,116,"myotube differentiation","BP"
"15553","GO:0071353",0.010091503011751,0.996275417683936,15,35,"cellular response to interleukin-4","BP"
"13938","GO:0060324",0.0100974431815724,0.995513682925621,21,53,"face development","BP"
"10712","GO:0043230",0.0101219078380347,0.991274992975591,511,1984,"extracellular organelle","CC"
"14852","GO:0065010",0.0101219078380347,0.991274992975591,511,1984,"extracellular membrane-bounded organelle","CC"
"5872","GO:0016758",0.0101613461367615,0.99351596598225,58,181,"hexosyltransferase activity","MF"
"3419","GO:0006974",0.0101642651285555,0.991767405385468,245,896,"DNA damage response","BP"
"298","GO:0000912",0.0102890652761928,0.998609042859213,6,9,"assembly of actomyosin apparatus involved in cytokinesis","BP"
"299","GO:0000915",0.0102890652761928,0.998609042859213,6,9,"actomyosin contractile ring assembly","BP"
"15095","GO:0070426",0.0103844916370615,0.998980489821517,5,7,"positive regulation of nucleotide-binding domain, leucine rich repeat containing receptor signaling pathway","BP"
"15866","GO:0071895",0.0103948584499444,0.99748159497278,9,17,"odontoblast differentiation","BP"
"13428","GO:0051771",0.0104089763299319,1,3,3,"negative regulation of nitric-oxide synthase biosynthetic process","BP"
"15469","GO:0071214",0.0104680822692517,0.992535979417058,97,326,"cellular response to abiotic stimulus","BP"
"17642","GO:0104004",0.0104680822692517,0.992535979417058,97,326,"cellular response to environmental stimulus","BP"
"4486","GO:0009897",0.0104947733075085,0.992370260865184,108,371,"external side of plasma membrane","CC"
"11437","GO:0045586",0.0105866173375545,0.998558930855812,6,9,"regulation of gamma-delta T cell differentiation","BP"
"2000","GO:0004559",0.0106397675588798,0.997765055005738,8,14,"alpha-mannosidase activity","MF"
"20038","GO:1903898",0.0106486010107617,0.998947337720894,5,7,"negative regulation of PERK-mediated unfolded protein response","BP"
"13147","GO:0051222",0.0107137687666367,0.992749654131786,74,239,"positive regulation of protein transport","BP"
"2823","GO:0006024",0.0107739802535834,0.994689940089021,26,69,"glycosaminoglycan biosynthetic process","BP"
"21440","GO:2000060",0.0108336636067844,0.994001830861745,35,101,"positive regulation of ubiquitin-dependent protein catabolic process","BP"
"1169","GO:0002707",0.0108844883073615,0.995088424977762,21,55,"negative regulation of lymphocyte mediated immunity","BP"
"392","GO:0001501",0.010912339891067,0.991682530536214,146,511,"skeletal system development","BP"
"5271","GO:0015379",0.010915710467616,0.998503081852902,6,9,"potassium:chloride symporter activity","MF"
"15644","GO:0071496",0.0109629492511847,0.994480965088358,27,74,"cellular response to external stimulus","BP"
"17164","GO:0098609",0.0110751316312733,0.990971717012002,256,929,"cell-cell adhesion","BP"
"15222","GO:0070664",0.0111701111304935,0.993971071312203,32,93,"negative regulation of leukocyte proliferation","BP"
"16174","GO:0072538",0.0112640417772923,0.995055321896673,20,50,"T-helper 17 type immune response","BP"
"1086","GO:0002562",0.0112703891225924,0.99440803419794,26,70,"somatic diversification of immune receptors via germline recombination within a single locus","BP"
"5720","GO:0016444",0.0112703891225924,0.99440803419794,26,70,"somatic cell DNA recombination","BP"
"2292","GO:0004982",0.011272346727268,1,3,3,"N-formyl peptide receptor activity","MF"
"7828","GO:0031929",0.0113393421741931,0.992845572507248,54,167,"TOR signaling","BP"
"10255","GO:0042307",0.0114545770886554,0.995373467423223,17,41,"positive regulation of protein import into nucleus","BP"
"6530","GO:0019957",0.011477228427203,0.996502432239734,11,24,"C-C chemokine binding","MF"
"986","GO:0002407",0.0115092836487575,0.996491119950253,11,24,"dendritic cell chemotaxis","BP"
"9720","GO:0035990",0.0115289381901215,1,3,3,"tendon cell differentiation","BP"
"9721","GO:0035992",0.0115289381901215,1,3,3,"tendon formation","BP"
"5539","GO:0016064",0.0115871593860136,0.993150302350973,42,128,"immunoglobulin mediated immune response","BP"
"4758","GO:0010738",0.011630516762542,0.998821998050017,5,7,"regulation of protein kinase A signaling","BP"
"10087","GO:0038202",0.011646313662915,0.993402199656154,37,107,"TORC1 signaling","BP"
"18923","GO:1901135",0.0116736000030801,0.990474106699831,253,939,"carbohydrate derivative metabolic process","BP"
"10766","GO:0043309",0.0116878492993318,1,3,3,"regulation of eosinophil degranulation","BP"
"17312","GO:0098876",0.011698574602613,0.992755543663799,50,152,"vesicle-mediated transport to the plasma membrane","BP"
